post_id,url,subreddit,created_utc,title,selftext,score,num_comments,upvote_ratio,over_18,top3_comments
1nibfqs,https://www.reddit.com/r/artificial/comments/1nibfqs/meta_rayban_display_glasses_design_hud_clips_leak/,artificial,1758009780.0,'Meta Ray-Ban Display' Glasses Design & HUD Clips Leak Ahead Of Connect,"Meta's HUD glasses with the sEMG wristband will in fact be Ray-Ban branded, a leaked video which also depicts the HUD and wristband in action reveals.

A quickly removed unlisted video on Meta's YouTube channel showed what will soon be Meta and EssilorLuxottica's full smart glasses lineup:

* The regular Ray-Ban Meta glasses.
* The recently-launched [Oakley Meta HSTN glasses](https://www.uploadvr.com/oakley-meta-hstn-glasses-now-shipping/).
* The rumored [Oakley Meta Sphaera glasses](https://www.uploadvr.com/oakley-meta-sphaera-design-leaks-ahead-of-connect-too/), with eye protection and a centered camera.
* The rumored monocular heads-up display (HUD) glasses controlled by Meta's long-in-development [sEMG wristband](https://www.uploadvr.com/meta-semg-wristband-gestures-nature-paper/), which are labeled as ""Meta Ray-Ban"" with the word ""Display"" underneath.",1,0,1.0,False,[]
1nibeql,https://www.reddit.com/r/artificial/comments/1nibeql/china_isnt_racing_to_agi_but_us_companies_are/,artificial,1758009668.0,"China isn’t racing to AGI — but U.S. companies are | American AI companies claim that the U.S. and China are locked in an escalating race to AGI. This is a powerful, yet misleading narrative.",,4,3,0.61,False,"['Nah not believing this lol', 'AGI is a smoke screen to suck all the resources away from everything else. No one but rich ppl and politicians in their payroll are participating in this race. But everyone but rich and powerful are impacted by this bs.', 'A _________ race!\n\nJust insert what ever you are trying to promote.']"
1nib2o3,https://www.reddit.com/r/artificial/comments/1nib2o3/google_introduces_vaultgemma_a_differentially/,artificial,1758008304.0,"Google introduces VaultGemma, a differentially private LLM built for secure data handling","Google has released VaultGemma, a large language model designed to keep sensitive data private during training. The model uses differential privacy techniques to prevent individual data points from being exposed, which makes it safer for handling confidential information in sectors like healthcare, finance, and government.

Tech report:
[https://services.google.com/fh/files/blogs/vaultgemma\_tech\_report.pdf](https://services.google.com/fh/files/blogs/vaultgemma_tech_report.pdf)",1,0,1.0,False,[]
