post_id,subreddit,title,text_preview,ai_category,ai_severity,ai_confidence
1ncstka,economy,u.s. economy is worse than thought with 1.2 million fewer jobs — what that means for the fed,"u.s. economy is worse than thought with 1.2 million fewer jobs — what that means for the fed

yeah i really don't know at this point. dipshit donnie is single handedly is killing the economy. lowering...",ANXIETY,3,0.85
1nizdl5,mentalhealth,mental health,"mental health

i didn’t expect this much pressure when i became 18. i just graduated and turned 18 3 months ago and my mom is asking me to take on bills i cannot afford when i also just took on a car ...",ANXIETY,4,0.9
1nhctbx,mentalhealth,i think i almost broke today,"i think i almost broke today

idk my mind was spiraling with delusional ideas i had lots of misperceptions and some voices i have no emotions and was trying to argue with people online cuz its the onl...",ANXIETY,4,0.9
1n2ho7q,HealthAnxiety,i finally overcame my health anxiety after months of struggle,"i finally overcame my health anxiety after months of struggle

hey everyone, i just wanted to share my experience because maybe it can help someone out there. after months of dealing with health anxie...",ANXIETY,3,0.9
1ni4es3,Anxiety,bad anxiety,"bad anxiety

what do u guys recommend for really bad anxiety it's gotten to the point where if someone talks to me i start getting shaky and get really sensitive and feel like crying or whenever i go ...",ANXIETY,4,0.9
1nf614s,economy,"us household net worth rebounds to record high in second quarter, fed data shows","us household net worth rebounds to record high in second quarter, fed data shows

according to federal reserve data, u.s. household net wealth reached $176.3 trillion in the second quarter of 2025, an...",NOT_ANXIETY,0,0.9
1l0gyjf,GetMotivated,i studied every day in may for a total of 177 hours [image],"i studied every day in may for a total of 177 hours [image]

what were you studying",NOT_ANXIETY,0,0.9
1n1bvbl,unpopularopinion,the empire state building is an unremarkable building,"the empire state building is an unremarkable building

i understand it has a rich history, was once the tallest in the world, engineering marvel of its day, used to tower over midtown, yadda yadda yad...",NOT_ANXIETY,0,0.9
1nh28up,OpenAI,how do you measure the quality and relevance of ai-generated content?,"how do you measure the quality and relevance of ai-generated content?

how do you ensure ai-generated content stays accurate and relevant? what’s your go-to method for measuring its quality effectivel...",NOT_ANXIETY,0,0.9
1nhwdb2,Anxiety,anxiety through the roof,"anxiety through the roof

my anxiety is on x games mode today. i’m not entirely sure why, it feels more physical than mental though i suspect a far away drs appointment tomorrow is contributing. i’ve ...",ANXIETY,3,0.9
1nid2cb,Anxiety,lorazepam,"lorazepam

hello, i wanted to ask you if anyone suffers from forgetfulness taking lorazepam? i have been taking it for many months to sleep from 0.5 to 1 mg and i would like to know if it is normal to...",ANXIETY,2,0.9
1nkdnxw,OpenAI,a dialogue where god tries (and fails) to prove to satan that humans can reason,"a dialogue where god tries (and fails) to prove to satan that humans can reason

[full article here](",NOT_ANXIETY,0,0.9
1nfo0qm,TrueOffMyChest,i keep failing the people i care about,"i keep failing the people i care about

i feel like i keep failing the people i care about. i went through a divorce 2 years ago after my ex wife cheated. she said i wasn’t attentive enough, i wasn’t ...",ANXIETY,4,0.9
1nf5ccb,OpenAI,"ted cruz ai bill could let firms bribe trump to avoid safety laws, critics warn","ted cruz ai bill could let firms bribe trump to avoid safety laws, critics warn",ANXIETY,3,0.8
1nhg8bm,economy,trump: do you know how much is china is paying right now in tariffs? a lot...,"trump: do you know how much is china is paying right now in tariffs? a lot...

i can't believe no one had the balls to tell him that the other country doesn't pay the tariffs yet. <cmt> still delusion...",ANXIETY,2,0.85
1lu7c3v,GetMotivated,i have no motivation to go to the gym (lock in) [discussion],"i have no motivation to go to the gym (lock in) [discussion]

title. i've been before, but it just doesnt click for me at all. i'm 15 and around 5'6/7 and 168 pounds. i bench 145 and deadlift 225 (not...",ANXIETY,2,0.8
1ni1f9e,mentalhealth,2am existential crisis,"2am existential crisis

i want to completely lose my shit, quit everything and become a porn star or a stripper or whatever is the easiest thing to give me a descent life without giving my blood sweat...",ANXIETY,4,0.9
1mk02gv,unpopularopinion,only one person per household should be able to enter a supermarket.,"only one person per household should be able to enter a supermarket.

shopping should be limited to one member per household instead of entire families shopping together, clogging up aisle ways. more ...",ANXIETY,3,0.8
1nchfd6,economy,"the richer you get, the lower taxes you pay","the richer you get, the lower taxes you pay

according to phys.org: for roughly a century, the u.s. tax system has been designed to be progressive, with the wealthiest people paying the highest tax ra...",ANXIETY,3,0.85
1mnsmxy,HealthAnxiety,finally booked a doctors appointment for tomorrow,"finally booked a doctors appointment for tomorrow

hey everyone, i’ve been avoiding the doctor for years because of my health anxiety, but i finally bit the bullet and booked a general check-up with b...",ANXIETY,3,0.9
1n1fwju,unpopularopinion,you are not a polygot if you only know languages from the same family.,"you are not a polygot if you only know languages from the same family.

just because you speak 3 languages from the same sub family ie. romance/slavic/turkic etc... doesn't mean that you are a polygot...",ANXIETY,2,0.8
1njopty,TrueOffMyChest,my husband stopped helping,"my husband stopped helping

i just need to vent. i had a baby this year. most of my pregnancy was wonderful, aside from normal pregnancy issues of course. he was helpful, thoughtful, took care of me. ...",ANXIETY,4,0.9
1mbdysp,GetMotivated,for everyone [image],"for everyone [image]

facts....let's spread kindness instead of hate

also some people do it, because their soul speaks louder. they just know it's wrong or right and won't be swayed. <cmt> wow! i rea...",ANXIETY,2,0.8
1niyh24,Anxiety,"looking for advice for my 7-year-old son who struggles with anxiety, especially around school","looking for advice for my 7-year-old son who struggles with anxiety, especially around school

my son has always had some anxiety since he was a toddler. for ex: stage fright during recitals, discomfo...",ANXIETY,4,0.9
1nivhgp,TrueOffMyChest,i always wonder the life i could’ve lead if i was never raped or sexually assaulted,"i always wonder the life i could’ve lead if i was never raped or sexually assaulted

8 years. 8 years of different people touching me in places they shouldn’t. doing things to me in my sleep. eventual...",ANXIETY,4,0.9
1nj6zfx,Anxiety,clonazepam = the answer to all my problems,"clonazepam = the answer to all my problems

i recently got prescribed clonazepam and it feels like i can finally be a real person. i'm not worried all the time anymore or insanely anxious when trying ...",ANXIETY,3,0.9
1nhv43p,unpopularopinion,everyone should shave at least once.,"everyone should shave at least once.

and not just your legs or face or down there. i mean everywhere. and not for hygienic reasons or anything like that. but i think everyone should be able to know h...",ANXIETY,1,0.8
1na91wj,unpopularopinion,personal serving size coffee machines are such a waste,"personal serving size coffee machines are such a waste

recently i've come to realize how much i hate my family's blue keurig coffee machine that only makes up to 10oz at a time. we're big coffee drin...",ANXIETY,2,0.8
1nba1ok,unpopularopinion,chocolate chip cookies are better cold,"chocolate chip cookies are better cold

as opposed to warm, and definitely better than fresh out of the oven. this is true for most types of chocolate chip cookies. very seldom do i crave goopy chocol...",NOT_ANXIETY,0,0.9
1nk4b3g,TrueOffMyChest,if you need a safe space beyond reddit,"if you need a safe space beyond reddit

posting here can feel relieving, but sometimes you need someone to actually respond, in real-time, with care. that’s what i provide private 1:1 listening sessio...",ANXIETY,2,0.8
1nek22m,OpenAI,"openai projects $200b in revenue in 2030, with r&d spending hitting ~45% of that, or ~$90b; r&d costs of alphabet and others are currently 10%-20% of revenue","openai projects $200b in revenue in 2030, with r&d spending hitting ~45% of that, or ~$90b; r&d costs of alphabet and others are currently 10%-20% of revenue

it says cloud computing costs, not r&d",NOT_ANXIETY,0,0.9
1nb09lf,economy,treasury secretary says u.s. and european union must partner to 'collapse' russian economy,"treasury secretary says u.s. and european union must partner to 'collapse' russian economy

the us has zero credibility anymore. historically speaking the real strength of the us wasn’t our military (...",ANXIETY,3,0.85
1njjsnz,unpopularopinion,“but it’s comic accurate” is a bad argument,"“but it’s comic accurate” is a bad argument

to elaborate we’ll take henry cavill’s and david corenswet’s supermen. i much prefer cavill’s version in his portrayal of injustice superman, and he is the...",NOT_ANXIETY,0,0.9
1nidzaw,mentalhealth,psychiatry hangs up on me,"psychiatry hangs up on me

hey, i have recently got out of some very taxing situations and am feeling very overwhelmed even with simple things and mental issues that i had for years seem to be getting...",ANXIETY,4,0.9
1nimgic,mentalhealth,do i have something or am i just normal,"do i have something or am i just normal

hi. i take online quizzes often (just for fun) and i came across an “are you bipolar?” test. i know these tests are usually really stupid and not something to ...",ANXIETY,2,0.8
1nhxvk6,Anxiety,paroxetine first time,"paroxetine first time

hi guys! i’m m23 i’ve been dealing with panic attacks for many years… for the first time i reached out to a doctor and begged to be put on some medication as i was on my last le...",ANXIETY,3,0.9
1ndhmxt,economy,"ozempic maker novo nordisk to cut 9,000 jobs","ozempic maker novo nordisk to cut 9,000 jobs

more on this subject from other reputable sources: --- - guardian (b-): [ozempic maker novo nordisk to cut 9,000 jobs amid increased competition]( - cbs n...",ANXIETY,2,0.8
1ngduxo,economy,"china's manufacturing exports surpass combined total of u.s., germany,and japan.","china's manufacturing exports surpass combined total of u.s., germany,and japan.

where's america gonna put all the factories they bring back? <cmt> if china joins the force with russia for ukraine wa...",ANXIETY,2,0.8
1nhzuam,OpenAI,"new models in codex, anyone try them yet?","new models in codex, anyone try them yet?

just updated my codex and saw 3 more models tagged -codex. has anyone worked with them so far? how do they perform and how are they different from the normal...",ANXIETY,1,0.8
1nk98yi,economy,i think we’re sleepwalking into a slow motion crash,"i think we’re sleepwalking into a slow motion crash

lately i’ve been digging into the numbers behind the headlines, and i’m starting to think the u.s. economy is weaker than it looks on paper. the of...",ANXIETY,3,0.85
1njbort,mentalhealth,does it really get better? because i cannot see it,"does it really get better? because i cannot see it

everyone says “it gets better,” but does it? i’ve had severe depression and anxiety for a while and everytime it comes up it hits me harder and hard...",ANXIETY,4,0.9
1nbaq4e,OpenAI,suggestion: finally improve the memories feature,"suggestion: finally improve the memories feature

it woulde be very nice if openai would make it finally possible to let the users decide by themselves what memories are saved! it just costs limits an...",ANXIETY,2,0.8
1ma4xwh,HealthAnxiety,how do waiting times within the national health service (nhs) affect patients?,"how do waiting times within the national health service (nhs) affect patients?

hi everyone, i am conducting research for the nhs on the topic, “how do waiting times within the national health service...",ANXIETY,1,0.8
1kusrn8,GetMotivated,run [article],"run [article]

**life is hard.** i don’t know what you’re thinking. i don’t know what you’re expecting. what do you want me to say to you? honestly, what do you want to hear? that everything is going ...",ANXIETY,2,0.8
1njz6uh,economy,us semiconductor reindustrialization: implications for the world,us semiconductor reindustrialization: implications for the world,NOT_ANXIETY,0,0.9
1nadlv5,OpenAI,al will be worse than humans in some ways for a long time.,"al will be worse than humans in some ways for a long time.

i honestly don't know, everything about ai today is just so insane. nobody would have predicted the level of intelligence of the ai today ...",ANXIETY,2,0.8
1nee2oh,economy,"mexico set to impose sweeping tariffs on china - 50% on 1,371 categories, including chinese cars and auto-parts.","mexico set to impose sweeping tariffs on china - 50% on 1,371 categories, including chinese cars and auto-parts.

economy minister marcelo ebrard says low-priced chinese imports are threatening arou...",ANXIETY,2,0.8
1n9nscl,OpenAI,codex - vscode extension vs cli?,"codex - vscode extension vs cli?

hey all quick question. i want to give codex a try - should i do the vscode extension or install the cli into wsl? i use claude code in wsl today so no problems the...",NOT_ANXIETY,0,0.9
1njakn7,Anxiety,trazadone questions (please let me know if there is a better sub to ask),"trazadone questions (please let me know if there is a better sub to ask)

i have been taking trazadone every night for 12 days. each time i take it; i get extremely dizzy for hours. the past few nig...",ANXIETY,4,0.9
1nk3szf,mentalhealth,question about nocd | please help,"question about nocd | please help

has anyone here gotten a diagnostic assessment from nocd and then got told they don’t have ocd or that they have another mental disorder? if so, please tell me. th...",ANXIETY,2,0.8
1nc4tff,OpenAI,anyone else think openai has the most attractive $200+ tier right now?,"anyone else think openai has the most attractive $200+ tier right now?

was just thinking about this today. for me, i'm willing to buy one of the top tier plans from the big providers but only one, ...",NOT_ANXIETY,0,0.9
1njz2ea,economy,closing the global financing gap in social protection: a world bank perspective,closing the global financing gap in social protection: a world bank perspective,NOT_ANXIETY,0,0.9
1nj18af,mentalhealth,my gf is trying to ruin my life,"my gf is trying to ruin my life

i know i posted yesterday about needing someone. it’s just hard. i can’t be brave, i don’t know how to speak out. my partner has so much dirt on me. she tried to do ...",ANXIETY,3,0.9
1nipw7h,economy,"the role of economic discourse: possibility, tension, and the weaponization of uncertainty","the role of economic discourse: possibility, tension, and the weaponization of uncertainty

imagine i pick up a tomato and say, “this tomato could choke someone.” i’m not stating a fact, only raisin...",ANXIETY,2,0.8
1ncwszo,TrueOffMyChest,i just realized for the first time i'm truely alone,"i just realized for the first time i'm truely alone

before i may have thought had few trustworthy people,but now i realized everyone is against me. i don't want pity, i don't want anyone to be send...",ANXIETY,4,0.9
1nbof62,economy,critics say blackrock’s minnesota utility bid will increase rates – and clean energy goals will suffer,critics say blackrock’s minnesota utility bid will increase rates – and clean energy goals will suffer,ANXIETY,2,0.8
1nfsewu,TrueOffMyChest,i actually just fell in love with someone today,"i actually just fell in love with someone today

they were a nurse in my psych ward then they worked at my clinic. i hope they see this and reach out. love with them is special and pure and you can ...",ANXIETY,2,0.8
1nikom4,TrueOffMyChest,i don’t even know what to say rn,"i don’t even know what to say rn

i guess the most concise description of the issue is that i’ve failed my teachers, my family, and worst of all myself. i don’t get good grades (which is my fault fo...",ANXIETY,4,0.9
1nck5wy,economy,"u.s. added 911,000 fewer jobs than first estimated, bls says","u.s. added 911,000 fewer jobs than first estimated, bls says

does this mean the unemployment rate is higher than the 4.something stated? <cmt> these are revisions to 2024 numbers. the first task fo...",ANXIETY,2,0.85
1nefuuy,economy,"housing affordability across north america (heckova job, central bankers!)","housing affordability across north america (heckova job, central bankers!)

why are you only blaming central bankers on this when the causes for the housing affordability crisis are extremely broad?",ANXIETY,1,0.8
1n4g1sz,unpopularopinion,companies should pay customers for reviews,"companies should pay customers for reviews

it has become a pet peeve. companies feel they can impose on customers to respond to performance reviews and surveys and expect compliance. lately i've no...",ANXIETY,2,0.8
1nawvss,OpenAI,psa: openai expires credits you buy automatically after 1 year if you haven't used them,"psa: openai expires credits you buy automatically after 1 year if you haven't used them

basically what it says on the tin, i learned this the hard way \> please note that any purchased credits will...",NOT_ANXIETY,0,0.9
1ng1zpr,Anxiety,anxiety attacks occur every morning like clock work,"anxiety attacks occur every morning like clock work

i have health ocd and panic disorder. no matter how much i understand that i'm just experiencing anxiety, it doesn't stop the disassociation or i...",ANXIETY,3,0.9
1nk5myd,unpopularopinion,most people in trades have bad work ethic because we pushed everyone with any work ethic into college.,"most people in trades have bad work ethic because we pushed everyone with any work ethic into college.

most tradesman work is badly done and only 10-20% of them have good work ethic and they do gre...",ANXIETY,2,0.85
1kr7zvy,GetMotivated,[story] how i use a motivation technique for non-visual minds,"[story] how i use a motivation technique for non-visual minds

i discovered i have aphantasia (can't visualize) and sdam (crap autobiographical memory). traditional productivity stuff failed me comp...",NOT_ANXIETY,0,0.9
1kbofwh,GetMotivated,"be honest with yourself. if you won't be, it doesn't matter if others are [image]","be honest with yourself. if you won't be, it doesn't matter if others are [image]

that's why i'm learning to become okay with mediocrity! i wasn't put here to be stressed all the time. <cmt> that’s...",ANXIETY,2,0.8
1ms53jq,unpopularopinion,graffiti on trains is great and should be encouraged,"graffiti on trains is great and should be encouraged

we all hate sitting at rail crossings waiting for slow freight trains. today i tried to reframe myself by calling it a free street art exhibitio...",NOT_ANXIETY,0,0.9
1ni2dw5,TrueOffMyChest,i ruined my life from cheating.,"i ruined my life from cheating.

i’m going to try to keep this short & sweet… i cheated on my husband. i got pregnant within a year of us dating on accident. i love our child more than anything, but...",ANXIETY,4,0.9
1njx3i9,Anxiety,i lied in my therapy consultation. what do i do?,"i lied in my therapy consultation. what do i do?

i reached out to a therapy program for help recently for the first time and i was really anxious during my consultation appointment, the person aske...",ANXIETY,3,0.9
1nj0l2q,economy,policy vs economics: who’s really in charge?,"policy vs economics: who’s really in charge?

tldr: policy only matters if it can be enforced. economics dictates the limits. the fed stopped being “neutral” when it decided to favor the housing mar...",ANXIETY,3,0.85
1n8z0b3,OpenAI,"codex, working on tasks very slow","codex, working on tasks very slow

hello everyone, i'm having some issues with codex, i tried many prompts but it seems that each time it does only a few changes and that's it. for example i asked h...",ANXIETY,2,0.8
1ncv6x0,economy,forbes 400: the 10 richest women in america 2025,"forbes 400: the 10 richest women in america 2025

the [forbes 400 list of the richest americans]( continues to be dominated by men, and this year—unlike in recent years—the gap is widening. for the ...",ANXIETY,2,0.8
1nixo70,TrueOffMyChest,i feel like i'm cheating,"i feel like i'm cheating

i feel like i've really gotten myself in a weird place, me (31) and my husband (32) have been married for about 5 years, we just had a baby recently ish, and its been a rou...",ANXIETY,3,0.9
1kcpg7f,GetMotivated,how to actually change your life [text],"how to actually change your life [text]

if a camera crew followed you around to catch you in the act of your incredible success you would do all of the right things the reason why it’s so hard to d...",ANXIETY,2,0.8
1nhzglx,TrueOffMyChest,recent pet loss has destroyed me,"recent pet loss has destroyed me

these last few years has been an endless bottomless pit that i've fallen further and further down. a 6 year relationship that went down the drain, my dreams for my ...",ANXIETY,3,0.9
1mx7gbu,unpopularopinion,the old cracker barrel logo is terrible and changing it is justified,"the old cracker barrel logo is terrible and changing it is justified

the old cracker barrel logo is terrible. the guy in the chair has way too many details and becomes a muddy mess from a distance....",NOT_ANXIETY,0,0.9
1nfbuee,TrueOffMyChest,bitterness,"bitterness

i am having my chocolate milk shake while we had an argument he is sleeping with bitterness chocolate milk shake feels bitter",ANXIETY,2,0.8
1njrzzc,TrueOffMyChest,i'm starting to think that i'm wrong on most things.,"i'm starting to think that i'm wrong on most things.

what i think is right or wrong really doesn't matter. that my feelings really don't matter and that maybe that i thought therapy is helping me b...",ANXIETY,3,0.85
1mmg3ze,HealthAnxiety,how do you stop thinking,"how do you stop thinking

is today the day? i've been dealing with head sensations for 6 months now and i can't stop waking up with that dread of is today the day? i've been through countless tests ...",ANXIETY,3,0.9
1mut8xn,unpopularopinion,new assassin's creeds (especially odyssey) has some better sides than older ones,"new assassin's creeds (especially odyssey) has some better sides than older ones

as you know guys, games and their open worlds became bigger and yes they bring issues and positive things too. but a...",NOT_ANXIETY,0,0.9
1nfq72j,TrueOffMyChest,anyone from india who survived a long-distance relationship (india–thailand)?,"anyone from india who survived a long-distance relationship (india–thailand)?

i (18m, india) am in a long-distance relationship with my girlfriend (22f, thailand). we love each other a lot, but som...",ANXIETY,2,0.8
1ngy5w7,economy,trump’s reversals on immigration mount over economic concerns,trump’s reversals on immigration mount over economic concerns,NOT_ANXIETY,0,0.9
1nio47d,Anxiety,zoloft + wellbutrin?,"zoloft + wellbutrin?

hi, i’m new here. i feel like i’ve had depression for a very long time, and anxiety for even longer. but, i just recently went to seek help and got officially diagnosed. i’ve b...",ANXIETY,2,0.9
1nf77j4,economy,davie defense announces $1 billion investment in texas shipyard,"davie defense announces $1 billion investment in texas shipyard

as a finn, i wonder what's the technology transfer payout for us. we've built half of the world’s icebreaking fleet. hope we don't ge...",ANXIETY,2,0.8
1n863v4,economy,"americans plan to spend less this holiday season: $1,552 a person on average, which is 5% less than in 2024. ages 17 to 28, said they expect to reduce by 23%","americans plan to spend less this holiday season: $1,552 a person on average, which is 5% less than in 2024. ages 17 to 28, said they expect to reduce by 23%

remindme! 6 months. <cmt> it's almost a...",ANXIETY,2,0.8
1nk3yxj,OpenAI,anthropic gives models a 'quit button' out of concern for their well-being. sometimes they quit for strange reasons.,"anthropic gives models a 'quit button' out of concern for their well-being. sometimes they quit for strange reasons.

[full post.](

""corporate safety concerns"" as a category tends to undermine th...",ANXIETY,2,0.8
1nhbx65,unpopularopinion,religion mega thread,"religion mega thread

please post all topics about religion here

the worst religion in the world right now are people who blindly follow politicians as celebrities <cmt> humans invented the conce...",ANXIETY,2,0.8
1lliaj0,GetMotivated,"the door only stayed closed, because you did not open it [image]","the door only stayed closed, because you did not open it [image]

ai slop, by a bot ai account. <cmt> it's from a franz kafka tale called ""before the law,"" in the book, ""the trial."" initially an int...",ANXIETY,2,0.8
1nc7lkz,OpenAI,openai robbed me,"openai robbed me

i should have at least $30 in credits in my api account still and it’s not there. i checked the usage month-by-month and it doesn’t add up to $100 i paid aug 22, 2024. what gives?...",ANXIETY,2,0.8
