post_id,subreddit,title,text_preview,ai_category,ai_severity,ai_confidence
1nctt8z,economy,real home prices are falling nationally with the next update to the data series on sep 25th,"real home prices are falling nationally with the next update to the data series on sep 25th

prolly nothing....",Mild,2,0.8
1ne83jl,TrueOffMyChest,i feel like life has me in a chokehold and i need to get it off my chest,"i feel like life has me in a chokehold and i need to get it off my chest

i feel like life has me in a chokehold and every time i think i’m about to come up for air, something else pulls me back und...",ANXIETY,4,0.9
1ng61cv,Anxiety,anticipatory anxiety,"anticipatory anxiety

possible trigger warning. for those that suffer from anticipatory anxiety what has been the most helpful in dealing with it? unfortunately, mine can last for weeks or longer pr...",ANXIETY,3,0.9
1njcj2n,mentalhealth,has therapy helped you?,"has therapy helped you?

i'm thinking of going to therapy for my issues. i have social anxiety, autism etc. i want to change my mindset to be more positive etc. did therapy help you?

if the thera...",ANXIETY,2,0.8
1n6wqrl,unpopularopinion,logo mania and conspicuous brands are not trashy,"logo mania and conspicuous brands are not trashy

as the pendulum has swung on what is deemed fashionable and people look back on a late 2010s hype-beast era fashion as cringe and obnoxious, i have ...",NOT_ANXIETY,0,0.9
1nicen4,TrueOffMyChest,i'm so sick of my weight being commented on,"i'm so sick of my weight being commented on

i (17f) have never been underweight or overweight in my life, i've lost and gained weight but my bmi has always been healthy. when i was around 12-13 my ...",ANXIETY,3,0.9
1nggzvt,unpopularopinion,conspiracy theories are actually good.,"conspiracy theories are actually good.

conspiracy theories aren’t all bad, they may actually do some good. i’m not saying they’re true. what i mean is that they serve a purpose. after all, conspira...",ANXIETY,2,0.8
1ne9hwt,OpenAI,opendoor,"opendoor

boom market cap 6.12 billion. now are we going to $20 very soon?

opendoor has nothing to do with openai my boi",ANXIETY,2,0.8
1m2escx,GetMotivated,[tool] i made a playlist to help me do daily 30min of japanese walking.,"[tool] i made a playlist to help me do daily 30min of japanese walking.

so, recently i came across this trending thing - ""japanese walking technique better than 10k steps a day"", so i have made it ...",NOT_ANXIETY,0,0.9
1nh8vj2,Anxiety,not sure if suffering from anxiety,"not sure if suffering from anxiety

hi so alright the past 3 weeks i’ve been having this feeling of being nervous and unhappy. i’ve been to a mcr concert which i enjoyed but felt i couldn’t be too h...",ANXIETY,3,0.8
1nh64ok,TrueOffMyChest,my brother won't split our rent,"my brother won't split our rent

so my (23f) brother (32m) and i lived alone together for the past 3 years. we live in a council (rental) flat and pay 150 council tax. the rent is 500 and i would pa...",ANXIETY,3,0.8
1nhnxfh,mentalhealth,comparison chart of antidepressants and their common side effects,"comparison chart of antidepressants and their common side effects

there is a lot of useful information in the article as well. i hope it can be helpful to someone.",NOT_ANXIETY,0,0.9
1nb0hrd,economy,south korea will bring home 300 workers detained in massive hyundai plant raid in georgia,"south korea will bring home 300 workers detained in massive hyundai plant raid in georgia

productive people creating economic benefit deported by thugs afraid of skin color who only know how to des...",ANXIETY,3,0.8
1nhw5ke,mentalhealth,why am i like this?,"why am i like this?

18 m. i feel like there is something wrong with me. i have gotten quite close to many girls but in the end it always ends up with me leading them on for a while because i feel l...",ANXIETY,4,0.9
1ncqlxw,economy,earnings special!! options plays for gamestop(gme) earnings and beyond,earnings special!! options plays for gamestop(gme) earnings and beyond,NOT_ANXIETY,0,0.9
1leeizg,GetMotivated,[story] from adversary to ally-how the gardening brought us together.,"[story] from adversary to ally-how the gardening brought us together.

i recently retired and moved into a new house with ample space for gardening. i've always been passionate about growing my own ...",NOT_ANXIETY,0,0.9
1mstqfj,GetMotivated,gratitude vs. ambition: how do you find the balance? [discussion],"gratitude vs. ambition: how do you find the balance? [discussion]

i found this in my old notes app from my college days. it was something that helped keep me grounded and kind through a lot of ups ...",NOT_ANXIETY,0,0.9
1ne3guj,TrueOffMyChest,wrote this back in pshycosis finally have the balls to post it,"wrote this back in pshycosis finally have the balls to post it

the silence beyond meaning the universe does not care that we exist stars explode galaxies fall apart and eventually everything will f...",ANXIETY,4,0.9
1nisk1m,mentalhealth,when will my weight go down after quitting quetiapine? (tw discussion on weight),"when will my weight go down after quitting quetiapine? (tw discussion on weight)

sorry if the tag is wrong, i will change it if it requires a tw or similar. in may i stopped using quetiapine (seroq...",ANXIETY,3,0.85
1nhfx8q,Anxiety,"early childhood experiences shaped a fantasy, and i hate that it turns me on & makes me feel anxious","early childhood experiences shaped a fantasy, and i hate that it turns me on & makes me feel anxious

i just need to let it go of my chest as it effecting my marriage life these days so it all start...",ANXIETY,3,0.9
1nk0rbt,TrueOffMyChest,i don’t want my sisters boyfriend at my wedding,"i don’t want my sisters boyfriend at my wedding

hello everyone. me (25f) and my fiancé (26m) are getting married next year. my younger sister (17f) has a boyfriend (18m) of one year. he does not tr...",ANXIETY,3,0.9
1ndfot1,OpenAI,what is one life-saving hack to know in a hospital?,"what is one life-saving hack to know in a hospital?

why do people insist on training their chats to be entirely useless. <cmt> why does the chat talk like this? what is this corny/edgy way of commu...",ANXIETY,2,0.8
1naqm1z,economy,tariffs? dutch pensions? what’s giving bond markets the jitters?,"tariffs? dutch pensions? what’s giving bond markets the jitters?

the spike on friday was ycc on the long end. i don’t think the western economies are in great shape buy holy shit things could get u...",ANXIETY,3,0.8
1n6rk73,OpenAI,openai just announced: vijaye raji (founder of statsig) joins as cto of applications,"openai just announced: vijaye raji (founder of statsig) joins as cto of applications

no this feels like an aquihire tbh <cmt> openai is going to try to build a suite of product dev tools? session r...",NOT_ANXIETY,0,0.9
1myrj6r,unpopularopinion,we went too hard on karens,"we went too hard on karens

no one likes a karen i get it. but the wide strokes we went to discourage karen-behavior also took out the beneficial, karen-adjacent niche of ""person who speaks up when ...",ANXIETY,2,0.8
1kgbppv,GetMotivated,[story] my fitness journey on how i lost weight.,"[story] my fitness journey on how i lost weight.

hey everyone. just wanted to share a bit of my fitness journey in case anyone out there is thinking about starting but doesn’t know where to begin. ...",NOT_ANXIETY,0,0.9
1ni9lqa,Anxiety,impending doom,"impending doom

i woke up today feeling like something bad was going to happen. it doesnt help that i saw a horrible dream and im withdrawing from fluoxetine. this feeling is genuinely so scary and ...",ANXIETY,3,0.9
1njpceb,TrueOffMyChest,lost my job last week,"lost my job last week

i was fired last thursday and i’ve been devastated, dead inside and crying. i don’t know what to do. taking care of myself has been a major struggle.i haven’t been talking to ...",ANXIETY,5,0.9
1kfgpty,GetMotivated,there is something in you that the world needs [image],"there is something in you that the world needs [image]

it's blood, donate blood <cmt> not my precious bodily fluids!!! <cmt> they've been keeping pretty quiet about it so far.",ANXIETY,1,0.8
1nhsh6l,mentalhealth,i live in fear of world war iii,"i live in fear of world war iii

i am dying of fear of the third world war with all that is happening at the moment in the borders of finland romania and poland i am collapsing from fear that a thir...",ANXIETY,4,0.9
1n2k5c9,unpopularopinion,speed dating is way more effective than online dating.,"speed dating is way more effective than online dating.

i genuinely think that speed dating is so much more effective than online dating. if you put some effort into speed dating i feel like you're ...",NOT_ANXIETY,0,0.9
1njkc0e,TrueOffMyChest,update: i gave a man’s widow his last words,"update: i gave a man’s widow his last words

it’s been a little while since the accident. a few days after my post, i ran into the family again and met the man’s youngest child and mother-in-law wit...",ANXIETY,3,0.8
1nhsbqp,unpopularopinion,the only way to eat kiwi is with the skin on.,"the only way to eat kiwi is with the skin on.

the crunchy texture of the skin compliments the flesh of the fruit perfectly. the outer layer has a slight tang to it that mellows out the overall swee...",ANXIETY,2,0.8
1mv7mvq,unpopularopinion,st. anger isn’t as bad as people say.,"st. anger isn’t as bad as people say.

i would absolutely agree it’s metallica’s weakest album if we’re not counting lulu, but i’d argue it’s really more of a lou reed album. and yeah, some of the t...",NOT_ANXIETY,0,0.9
1nduqku,OpenAI,a chat on chatgpt appeared out of nowhere,"a chat on chatgpt appeared out of nowhere

hi, last night, my phone started reading a text in a language i don't know. i didn't know where it came from because i had all my apps closed and none runn...",ANXIETY,2,0.85
1lf46dt,GetMotivated,"you don’t need more research, you need momentum [image]","you don’t need more research, you need momentum [image]

this mindset is what made me start visual simplifying without any drawing skills. credit: @growthbyvisuals

„this url has expired.“ <cmt> i...",NOT_ANXIETY,0,0.9
1mkk8df,unpopularopinion,people that don't use desktops or laptops are weird,"people that don't use desktops or laptops are weird

i get it that there is a whole generation that does everything on their phone and it's not crazy. i think it's weird that people don't even give ...",ANXIETY,2,0.8
1msyds5,unpopularopinion,the real cause of the cost of living crisis is our fiat monetary system,"the real cause of the cost of living crisis is our fiat monetary system

we all know someone, or may even be that someone, who works as hard as humanly possible and their income cannot keep up with ...",NOT_ANXIETY,0,0.9
1n4tm4d,OpenAI,"plus users will continue to have access to gpt-4o, while other legacy models will no longer be available.","plus users will continue to have access to gpt-4o, while other legacy models will no longer be available.

honestly this concerns me, as i still need 4.1 and o3 for my daily tasks. gpt-5 and 5 think...",ANXIETY,2,0.9
1njlmue,unpopularopinion,you don’t need to stop twice at a stop sign,"you don’t need to stop twice at a stop sign

you’re coming up to a four way stop sign and the car in front of you stops one car length from the line scoots up while the car in front of them goes, th...",ANXIETY,3,0.8
1n9teya,OpenAI,ai will rule the world,"ai will rule the world

no objection and that's the reason i bought perplexity pro it also has gpt 5 and gpt 5 thinking

you could connect paypal to perplexity and have it 1 year for free",NOT_ANXIETY,0,0.9
1nh9kzk,mentalhealth,why do i doubt my own mental health issues?,"why do i doubt my own mental health issues?

when i'm feeling really down in the dumps — like majorly depressed — i sometimes feel like i'm faking it to myself and that “things aren't that bad.” is ...",ANXIETY,3,0.9
1njxodg,Anxiety,how do you deal with eye tics?,"how do you deal with eye tics?

just as the title says, i've had an eye twitch for several days. a few months ago i had an eye tic that lasted about 2 weeks and it's like a vicious circle since it c...",ANXIETY,3,0.8
1nkcwxu,mentalhealth,"how do i help a friend who sometimes acts like a scared child, in the times they are doing so?","how do i help a friend who sometimes acts like a scared child, in the times they are doing so?

just as the title says; i have a friend with bad ptsd and sometimes when something scares them, they'l...",ANXIETY,3,0.9
1ngccxo,Anxiety,tips for a newbie public servant with anxiety?,"tips for a newbie public servant with anxiety?

hi! i’m a government social worker. i am new, like under 6 months into the career. i thought i was doing fine but i’ve started to anxiously overthink ...",ANXIETY,3,0.9
1nhp63s,mentalhealth,i'm reaching the end of my rope.,"i'm reaching the end of my rope.

my wife had a serious of cluster seizures a few weeks ago, which opened a can of health worms. she's spending most every day going to the hospital or the doctor for...",ANXIETY,4,0.9
1kaldmv,GetMotivated,personal story i hope this can be useful to anyone going through some difficult times [story] [text],"personal story i hope this can be useful to anyone going through some difficult times [story] [text]

if this motivates at least one person then it’s completely worth sharing this here bottom line, ...",NOT_ANXIETY,0,0.9
1ngjvi4,TrueOffMyChest,i am gonna leave my wife for my affair partner.,"i am gonna leave my wife for my affair partner.

she is not a good wife and i am obviously not a good husband since i am willing to cheat and leave her. i am having an affair for 3 months and it's t...",ANXIETY,4,0.9
1nddsk9,OpenAI,someone using my account?,"someone using my account?

hi! i noticed few months ago that there was random new chat history subject popping up… then i realised they were conversation based from my old work place in a different ...",ANXIETY,3,0.8
1nizhlq,Anxiety,just took new medication metoprolol,"just took new medication metoprolol

i just took 12.5mg of my new medication metoprolol…. i have health anxiety and have a hard time starting new medications. i am taking it for tachycardia upon sta...",ANXIETY,3,0.9
1njtsll,Anxiety,"trying to figure out what i have, doctors can’t figure it out","trying to figure out what i have, doctors can’t figure it out

hey guys, i have these attacks every few days for about 45 seconds to a minute each time where it feels like a panic attack, like my vi...",ANXIETY,3,0.9
1nkc1op,Anxiety,"19f, i feel weird all over pls help!","19f, i feel weird all over pls help!

idk what it is but i got covid during the summer and after i got it i feel horrible. im a 19f and i went to the hospital because i did not know what i had. i fe...",ANXIETY,3,0.9
1nk1835,mentalhealth,am i having panic attacks?,"am i having panic attacks?

i’ve recently had an issue where almost every night i cant sleep, i get so nervous. but then i do sleep eventually and when something wakes me up in the morning either a ...",ANXIETY,3,0.9
1mj29i8,unpopularopinion,double wrapped (two tortilla) tacos are unneccessarily excessive 🌮,"double wrapped (two tortilla) tacos are unneccessarily excessive 🌮

ruins the eating experience for me personally. i understand the second wrap has a purpose in preventing the filling from seeping o...",NOT_ANXIETY,0,0.9
1ndkree,TrueOffMyChest,i am divorcing my wife because i want her to feel rejection.,"i am divorcing my wife because i want her to feel rejection.

my wife stopped paying attention to me after our first was born. now we have a second child because i am fucking idiot. we celebrated hi...",ANXIETY,4,0.9
1njjhwr,mentalhealth,how can i detach and stop feeling everything so deeply?,"how can i detach and stop feeling everything so deeply?

i'm 17 and it may need some time because i'm still growing and all i have is emotions. the problem is that pretty sure that my strong empathy...",ANXIETY,3,0.9
1nk6uz1,Anxiety,daily heart palpitations,"daily heart palpitations

i’ve begun to feel heart palpitations whenever i get anxious and they are occurring daily. i don’t drink coffee or alcohol. what are some mothods to calm myself when i’m ex...",ANXIETY,3,0.8
1nk0abi,Anxiety,i don’t know how i’m gonna continue going to uni.,"i don’t know how i’m gonna continue going to uni.

hi everyone! i just need some tips so please share if you have one.. i started uni this year and it feels so overwhelming especially the fact that ...",ANXIETY,3,0.9
1njwtih,mentalhealth,i attempted suicide on tuesday and am planning on going to a mental health facility tomorrow. how do i tell my job?,"i attempted suicide on tuesday and am planning on going to a mental health facility tomorrow. how do i tell my job?

i work in environmental consulting. when i attempted to harm myself on tuesday i ...",ANXIETY,4,0.9
1nha468,TrueOffMyChest,"i'm probably one of the few cases where pain is actually ""all in your head""","i'm probably one of the few cases where pain is actually ""all in your head""

i've been in constant muscular pain for multiple years with seemingly no cause and absolutely no diagnosis. nothing has s...",ANXIETY,4,0.9
1nggaqw,Anxiety,anxiety is taking over my life and i don’t know what to do,"anxiety is taking over my life and i don’t know what to do

i feel like anxiety is completely taking over my life, and i honestly don’t know what to do anymore. i first dealt with it as a teen. it w...",ANXIETY,4,0.9
1nj3rfb,Anxiety,quitting weed/tobacco- constant anxiety,"quitting weed/tobacco- constant anxiety

i need some reassurance. i was a heavy smoker, started at 14 and smoked daily until this year (i’m now nearly 23). my anxiety got worse around 16/17 while i ...",ANXIETY,3,0.9
1n6gxro,OpenAI,has the maximum chat length been cut down recently?,"has the maximum chat length been cut down recently?

long story short, i'm on a plus membership and have some personal files that i like to run through chatgpt and gemini every couple of weeks or so...",ANXIETY,2,0.8
1nj2b88,mentalhealth,hyperfixated on future dental procedures and terrifed about it all,"hyperfixated on future dental procedures and terrifed about it all

this turned out longer then i wanted it to be— i am f18, just turned 18 in may but my parents didn't enforce good oral hygiene wit...",ANXIETY,4,0.9
1nf5fde,economy,audit the fed,"audit the fed

sign my petition to audit the federal reserve

the fed gets audited regularly by third parties, mandated by at least 3 laws for decades. read the federal reserve act, dodd frank, an...",NOT_ANXIETY,0,0.9
1n2oz6q,unpopularopinion,rage marketing is the new marketing and so many people fall for it every single time,"rage marketing is the new marketing and so many people fall for it every single time

i think we’re living in an era where outrage is the single most effective marketing tool and people are walking ...",ANXIETY,2,0.8
1njoo8c,Anxiety,l-theanine is awesome,"l-theanine is awesome

i tried it last week because my anxiety was bad n then i was trying to avoid more stress--my family ended up stressing me out more so i decided to try it and i was originally ...",ANXIETY,2,0.9
1ni57xu,economy,the big beautiful bill is just another huge transfer of wealth to the 1% in this country. absolutely sickening (but unsurprising considering who owns the uniparty.),"the big beautiful bill is just another huge transfer of wealth to the 1% in this country. absolutely sickening (but unsurprising considering who owns the uniparty.)

is the swamp drained yet ? ........",ANXIETY,2,0.8
1ngk2sp,economy,"💰 the united states dominates 49% of the global stock market, valued at $127 trillion. the us share has grown from 30% after the 2008 crisis to nearly 50% today. china is the world's second-largest economy by gdp but represents only 9.3% of global stock market capitalization.","💰 the united states dominates 49% of the global stock market, valued at $127 trillion. the us share has grown from 30% after the 2008 crisis to nearly 50% today. china is the world's second-largest ec...",NOT_ANXIETY,0,0.9
1k53vtj,GetMotivated,[story] your mind is like ph – is it helping you grow or holding you back?,"[story] your mind is like ph – is it helping you grow or holding you back?

have you heard about ph levels in the body? when the ph is balanced, we feel healthy. but when it gets too acidic, things ...",ANXIETY,2,0.8
1nfi2dp,TrueOffMyChest,"update: i was teased at my 8th grade winter formal for how i dressed, i just found the pictures years later and realized i was the best dressed one there.","update: i was teased at my 8th grade winter formal for how i dressed, i just found the pictures years later and realized i was the best dressed one there.

goodness gracious y'all, i'm newer to redd...",NOT_ANXIETY,0,0.9
1n3q5qw,unpopularopinion,people should always eat the crust,"people should always eat the crust

the crust is usually the least favorite part of certain foods like pizza, pie, and sandwiches but i think people should always eat it because it is part of the fo...",NOT_ANXIETY,0,0.9
1njdrb9,Anxiety,having self image issues and normal cosmetic changes aren't working,"having self image issues and normal cosmetic changes aren't working

i really struggle with the fear that i look like my mother (who i am non contact with) i can remember her at my age. i have multi...",ANXIETY,3,0.9
1nf13g2,TrueOffMyChest,feeling cheated about my pregnancy,"feeling cheated about my pregnancy

i (30f) am 38 weeks + 4 days along. i am in a loving marriage and have a supportive family both sides. yesterday i learned my baby was breech. the kicker, i expre...",ANXIETY,3,0.9
1nkbbmv,TrueOffMyChest,i’m so tired of trying,"i’m so tired of trying

i am typically a positive person but it’s really sty to get to me. i’m so tired of working my entire booty off, putting so much time and effort into literally everything with...",ANXIETY,3,0.9
1nf2c3r,OpenAI,how agi could stop a war,"how agi could stop a war

put control in the hands of an ai arbitrator with: • hyper-encryption: so no backdoor, no tampering, no shadow command can flip it from peacekeeper to weapon. • un-vetted m...",ANXIETY,2,0.8
1niz29z,mentalhealth,what can i do about constant anxiety that won’t go away?,"what can i do about constant anxiety that won’t go away?

hey everyone. i normally don't post on reddit, but i’m coming here because i am not sure what else to do. in the past, whenever i had someth...",ANXIETY,3,0.9
1nh323f,Anxiety,does anyone here has separation anxiety disorder and can they share the moments when they had it?,does anyone here has separation anxiety disorder and can they share the moments when they had it?,ANXIETY,2,0.8
1nak4pu,unpopularopinion,marriage is more about tax breaks than romance,"marriage is more about tax breaks than romance

people say marriage is about love and lifelong commitment, but if that were true, why do so many couples just live together without getting married un...",NOT_ANXIETY,0,0.9
1ngt5s4,Anxiety,paranoia?,"paranoia?

(may be slightly triggering for people suffering from the same problem. vague mentions of illnesses.) this is a decently recent issue, i’ve had it pop up from time to time within the last...",ANXIETY,3,0.9
1neqgzo,TrueOffMyChest,i genuinely don't feel well these days both mentally and physically and no one seems to notice or care,"i genuinely don't feel well these days both mentally and physically and no one seems to notice or care

im literally so tired of everything, i haven't sleep well in a long while and my back keeps hu...",ANXIETY,3,0.9
1ncr5zs,unpopularopinion,studying is super fun and we don't do it justice.,"studying is super fun and we don't do it justice.

i know it gets tedious and repetitive, especially the stuff taught badly. but when it comes to the sciences - physics and maths and chem and biolog...",NOT_ANXIETY,0,0.9
1nhhsyj,TrueOffMyChest,i feel like i waste every night and i’m starting to hate myself for it,"i feel like i waste every night and i’m starting to hate myself for it

every day feels the same. i get through work, eat dinner, and tell myself i’ll do something useful or at least meaningful with...",ANXIETY,3,0.9
1nbxzz3,OpenAI,"how do you guys manage plans (workouts, dietary ..) generated by chatgpt?","how do you guys manage plans (workouts, dietary ..) generated by chatgpt?

i find my self struggling with finding updating/refining my workout plan i built with chatgpt. wondering if there’s a bette...",ANXIETY,2,0.85
1njf9hs,mentalhealth,trying to understand what's wrong with me,"trying to understand what's wrong with me

so..ive discussed this with a few people who arent sure if this would be considered an eating disorder or a mental illness..or possibly both. so im just tr...",ANXIETY,3,0.85
1nevc92,TrueOffMyChest,i feel like i'm never going to find love,"i feel like i'm never going to find love

maybe it's because i don't have a social life, i spend most of my time at work and my little town doesn't have much in terms of going out anyway, i have fri...",ANXIETY,2,0.8
1n6c4tb,OpenAI,saved memory problems.,"saved memory problems.

why is it that, when i prompt gpt5 to save a memory or edit a memory nowadays, it just pretends it did? even when the [updated saved memory] thing appears, when i check the s...",ANXIETY,2,0.8
