post_id,subreddit,title,text_preview,ai_category,ai_severity,ai_confidence
1n652up,OpenAI,did they remove 4.0 again?,"did they remove 4.0 again?

the removed it before but now i think they removed it again eeekkk so annoying

i'm on 4o and it feels awful now. they've clearly been changing stuff under the hood tha...",ANXIETY,2,0.85
1nd2gej,TrueOffMyChest,"tried on a skirt in size m, my roommate said my thighs look big","tried on a skirt in size m, my roommate said my thighs look big

yesterday my roommate asked me if i usually wear size m. i said no, because i’ve always worn xs, and only recently, after reaching 50...",ANXIETY,2,0.9
1nh7ril,Anxiety,how do i (f20) deal with intense anxiety around college and lectures?,"how do i (f20) deal with intense anxiety around college and lectures?

for context i’m in my final year in college. the last 2 years were a disaster for me, and it all comes down to some big struggl...",ANXIETY,3,0.9
1nfw7js,OpenAI,codex on windows,"codex on windows

hey peeps, currently use claude code through vsc on windows (wsl). interested in trying codex but have zero idea how to get it to work. i currently have the pro subscription. if an...",NOT_ANXIETY,0,0.9
1n5r5k8,OpenAI,can anyone give me an example prompt the use to create photorealistic images of historical landmarks?,"can anyone give me an example prompt the use to create photorealistic images of historical landmarks?

i'm trying to get an image of the sphinx as it looked at the time of completion. doesn't have t...",ANXIETY,2,0.8
1nhjhbz,economy,weekly fed reports,"weekly fed reports

this week fed releases: monday - t-bill auctions tuesday - retail sales, import/export prices, wednesday - fomc, housing starts, rates decision 8-| thursday - jobless claims, fed...",ANXIETY,2,0.8
1njs3vw,Anxiety,anxiety/stress rash?,"anxiety/stress rash?

i’ve had a lot going on this year medically, as well as financially and of course mentally. i’ll spare all the details, but lately i’ve been getting this red splotchy rash on m...",ANXIETY,2,0.8
1msvs4r,unpopularopinion,concerts should include a digital recording of the performance with a purchase of a ticket and ban phone recordings.,"concerts should include a digital recording of the performance with a purchase of a ticket and ban phone recordings.

it sucks having all these people watching the show through their phones that the...",ANXIETY,2,0.8
1nj522n,TrueOffMyChest,i really want to hate him right now.,"i really want to hate him right now.

hi there, okay, i'm writing this as a vent cause i have no one to say this to. i'm so fucking mad at my boyfriend. he's such an asshole to me and i'm so exhaust...",ANXIETY,4,0.9
1kh74uk,GetMotivated,[discussion] i struggled with my productivity. here's how i reclaimed my motivation,"[discussion] i struggled with my productivity. here's how i reclaimed my motivation

lately, work has been overwhelming, and staying motivated consistently has become a real challenge for me. on top...",ANXIETY,2,0.8
1nbyydo,economy,"the sector is clearly differentiated, and the new constituent stocks are eye-catching","the sector is clearly differentiated, and the new constituent stocks are eye-catching

# stock market today: dow up, nasdaq hits high as this goose flies above entry; amazon, tesla test buy points (...",NOT_ANXIETY,0,0.9
1nfqsft,GetMotivated,"[image] what disturbs you more, the event or your judgment about it?","[image] what disturbs you more, the event or your judgment about it?

a wise person told me, when watching the mind, focus on the mechanics of the mind, not the content. really changed my perspectiv...",NOT_ANXIETY,0,0.9
1ng4ya2,TrueOffMyChest,i’m secretly in love with my best friend and yesterday he introduced me as his sister.,"i’m secretly in love with my best friend and yesterday he introduced me as his sister.

throw away because he knows my account name. i [25f] have known my best friend [26m] for 12 years. i’ve been s...",ANXIETY,3,0.8
1ncbdxk,unpopularopinion,any burger with more than one patty is bad,"any burger with more than one patty is bad

why is every restaurant trying to add more meat to their sandwich? ground beef tastes fine but there's a reason nobody eats it by itself. put more than 4o...",NOT_ANXIETY,0,0.9
1nke28u,Anxiety,losing hope,"losing hope

ive had health anxiety for 2 minths now. ever since i discovered ffi. it ruined me. ive already posted on here so ill stop with inductions. but for the past week i felt good. ive been g...",ANXIETY,4,0.9
1nhn4vu,OpenAI,new swiftfox (gpt-5 high new) model in codex,"new swiftfox (gpt-5 high new) model in codex

new **swiftfox** model in codex cli that's ""faster, a better collaborator, and more steerable"" according to openai. it’s a reasoning model. looks like o...",NOT_ANXIETY,0,0.9
1nfy2w6,GetMotivated,[image] who is clapping for themselves today?,"[image] who is clapping for themselves today?

if was easier to clap for myself running every day after i got my bbl. <cmt> get a firm understanding of the consequences if you stray from the path. s...",ANXIETY,2,0.8
1lzc3j0,GetMotivated,experience is the best teacher [image],"experience is the best teacher [image]

failure sucks but it's the only teacher that doesn't lie to you

failure is just success that took a wrong turn and got lost. <cmt> i don't fail. i just fin...",NOT_ANXIETY,0,0.9
1njkojb,Anxiety,pain under the breast on the left side under where the heart is,"pain under the breast on the left side under where the heart is

anybody know what this is? it’s there for a few seconds then goes, comes back a minute later? feel abit like a pinching feeling. i ha...",ANXIETY,2,0.8
1nbyi0s,economy,the unmitigated disaster of bitcoin: a prudent investor's guide to avoiding financial sovereignty.,the unmitigated disaster of bitcoin: a prudent investor's guide to avoiding financial sovereignty.,ANXIETY,2,0.8
1muuvut,unpopularopinion,ceos giving themselves insane bonuses hurts local companies competing vs china more than chinese government subsidies hurt those same companies,"ceos giving themselves insane bonuses hurts local companies competing vs china more than chinese government subsidies hurt those same companies

pretty simple, us subsidizes an industry the c levels...",ANXIETY,2,0.85
1ne2ueu,unpopularopinion,exaggerated accents are unfunny,"exaggerated accents are unfunny

i just don’t think it adds to anything or makes anything funnier. it’s not a “they’re racist for this” thing, i just think it takes away from what someone is saying....",NOT_ANXIETY,0,0.9
1mtu6e2,unpopularopinion,helluva boss is horrible,"helluva boss is horrible

is it just me or is helluva boss horrible? yes the characters are cool but the episodes are sht. like wdym theres a sad ending to the episode knowing damn well its not gonn...",ANXIETY,2,0.8
1n8m2at,economy,how did the term “avocado toast” come to represent millennial spending habits in america?,"how did the term “avocado toast” come to represent millennial spending habits in america?

we took a vote. next time, we will invite you. really. we will",NOT_ANXIETY,0,0.9
1lngaxr,GetMotivated,[discussion] planning for small wins completely shifted my perspective,"[discussion] planning for small wins completely shifted my perspective

instead of aiming to overhaul my whole life, i started breaking goals down into tiny daily tasks. crossing off even the smalle...",ANXIETY,2,0.8
1niwngy,mentalhealth,functioning gets fucking hard sometimes,"functioning gets fucking hard sometimes

19 going on 20, finished highschool more than a year ago. while in highschool i started taking classes for the profession i wanna work in as an adult and had...",ANXIETY,4,0.9
1ncfrgs,economy,the 2025 american dream will cost you $5 million,"the 2025 american dream will cost you $5 million

by aliss higham - us news reporter: the american dream has long symbolized the promise of opportunity, prosperity, and upward mobility. coined in 19...",ANXIETY,2,0.8
1njh21x,Anxiety,pain and uncomfortable back...,"pain and uncomfortable back...

ive been having uncomfortable and painful lower back sometimes when i start to stress out. when this happens i start to stress out even more because it feels really o...",ANXIETY,3,0.9
1nhy39u,TrueOffMyChest,getting treated differently after losing weight?,"getting treated differently after losing weight?

i’m a 20 year old male. two years ago i was sitting around 310 lbs, a year ago i was 280, and right now i’m about 205. still not at my end goal, but...",ANXIETY,2,0.8
1lqe12b,GetMotivated,[story] i never oversleep anymore,"[story] i never oversleep anymore

after leaving the structure of school, i spent nearly 7 years living in total chaos. if you’ve ever struggled with sleep or keeping a regular routine, i really rec...",ANXIETY,2,0.8
1lrxpev,GetMotivated,[discussion] how important is it to keep balance in life ?,"[discussion] how important is it to keep balance in life ?

i don’t know if balance is the right word but i’m trying to understand how do you learn to be happy but also learn to stabilize your life....",ANXIETY,2,0.8
1njdj5k,economy,44 of the biggest 50 metros are flashing a grave warning that a house price crash is next,"44 of the biggest 50 metros are flashing a grave warning that a house price crash is next

how long have i herd this",ANXIETY,2,0.8
1ne2dv5,TrueOffMyChest,can’t get over the feeling of being manipulated by everyone and everything,"can’t get over the feeling of being manipulated by everyone and everything

does anyone else have trouble believing anything lately ? like i don’t support any political view or anything i just wanna...",ANXIETY,3,0.85
1kob9tt,GetMotivated,how the stars aligned to make my dreams come true (oc) [story],"how the stars aligned to make my dreams come true (oc) [story]

as a little girl, my dad used to take me to new york rangers' games at madison square garden (msg). i loved the energy and environment...",ANXIETY,2,0.8
1ni66sw,Anxiety,i will lose my job if i don't beat my alarm anxiety. i would do everything to make my brain shut up,"i will lose my job if i don't beat my alarm anxiety. i would do everything to make my brain shut up

it's 4:52 am now. i needed to wake up at 6 to make it to office. bcz i can't sleep and commuting ...",ANXIETY,4,0.9
1njchv6,mentalhealth,"i’m scared, and want some advice.","i’m scared, and want some advice.

i have religious ocd, quite extreme, i’m on medication but it’s ineffective. a few weeks ago, 3 ish i saw a figure in my garden, it looked like a dead relative. no...",ANXIETY,4,0.9
1nhwjlr,OpenAI,gpt-5-codex made a playable doom replica in html in one shot,"gpt-5-codex made a playable doom replica in html in one shot

i try every new model with this simple prompt. gpt-5-codex is the first model that succeeded. prompt: \`\`\` write simple doom / wolfens...",NOT_ANXIETY,0,0.9
1mim8n7,unpopularopinion,nothing in sports will ever compare to max holloway knocking out justin gaethje at ufc 300,"nothing in sports will ever compare to max holloway knocking out justin gaethje at ufc 300

leading up to it, people said max was too small. that he was gonna get run over. that gaethje was too viol...",NOT_ANXIETY,0,0.9
1mw0k37,HealthAnxiety,mental health,"mental health

recently joined this group, so i am not trying to offend anyone. i really hope everyone is doing well out there. i have been really working on my mental health for 8 years and i truly...",ANXIETY,2,0.9
1n7986v,OpenAI,account deleted or deactivated,"account deleted or deactivated

hi everyone, i keep getting the authentication error when try to login ""you don't have an account because it has been deleted or deactivated"". i forgot to verify my a...",ANXIETY,3,0.9
1mqiba1,unpopularopinion,"the ohio state - michigan ""the game"" rivalry is forced by the media and not interesting","the ohio state - michigan ""the game"" rivalry is forced by the media and not interesting

seriously outside of these two schools i don't know anyone who cares about this rivalry. texas-oku, alabama-a...",NOT_ANXIETY,0,0.9
1nhu4c6,mentalhealth,fitness and depression,"fitness and depression

i am curious if anyone has gone through what comes next. i’m a 49yo guy, work with a trainer at the gym three days a week, do 4-5 days of moderate cardio yet the depression m...",ANXIETY,3,0.85
1nis8dn,Anxiety,"phobia triggered at work, embarrassed about overreacting","phobia triggered at work, embarrassed about overreacting

i have a rabies/bat phobia and thought i'd never encounter it in real life. yesterday a bat got into my workplace and flew into my hair/shou...",ANXIETY,4,0.9
1ni0yil,Anxiety,tips to learn to dance as an adult with social anxiety (26f),"tips to learn to dance as an adult with social anxiety (26f)

i really want to learn to dance but have always been too socially anxious to do it. anyone have any tips or suggestions on what form of ...",ANXIETY,2,0.9
1mv608f,unpopularopinion,the paintings in the cystine chapel are tacky,"the paintings in the cystine chapel are tacky

it's just paint, while other beautiful religious buildings have beautiful architecture, it'sjust paint. like how greek statues look so much better as e...",ANXIETY,2,0.8
1nf1vy5,economy,why wall street is ok with a little sticky inflation,"why wall street is ok with a little sticky inflation

it is the easiest way to expand margins as long as consumers are willing to keep buying and we are until we just don't have the funds or credit ...",ANXIETY,2,0.8
1nfstjc,TrueOffMyChest,i pretend to be a feminist because i don't like women.,"i pretend to be a feminist because i don't like women.

i have a lot of trauma with women so i don't particularly like them. for a long time i wasn't interested in women or dating. then i went on a ...",ANXIETY,3,0.9
1nha0da,unpopularopinion,the “biggus dickus” bit in monty python is not funny in the slightest.,"the “biggus dickus” bit in monty python is not funny in the slightest.

it’s a blemish on an otherwise great movie (‘life of brian’) and goes on for waaaaaaayyyy too long. feels more like something ...",NOT_ANXIETY,0,0.9
1n6kvkl,OpenAI,does anyone else get the feeling there is some kind of push to make ai like chatgpt less useful for home users/life stuff?,"does anyone else get the feeling there is some kind of push to make ai like chatgpt less useful for home users/life stuff?

chatgpt 4o and 4.1 was the epitome of a great model for home users/life st...",ANXIETY,3,0.9
1niey0a,mentalhealth,i have no joy in life anymore.,"i have no joy in life anymore.

i’m autistic btw i mean beforehand the “spark” of life is very much in myself with me just happy to be alive, everything excited me. but after school, yelling and the...",ANXIETY,3,0.85
1nh375b,GetMotivated,[discussion] what’s your best strategy to get motivated after feeling hopeless that things will not work out?,"[discussion] what’s your best strategy to get motivated after feeling hopeless that things will not work out?

please let me know about this. thank you.

find wins and get the feeling of achieveme...",ANXIETY,2,0.8
1mvlr5f,GetMotivated,your workspace is either helping you succeed or holding you back - there's no neutral [discussion],"your workspace is either helping you succeed or holding you back - there's no neutral [discussion]

to all those people who say they can (or can’t) work anywhere: if you’re sitting at a kitchen tabl...",ANXIETY,2,0.8
1ninaqk,Anxiety,phantom smells?,"phantom smells?

does anyone else get phantom smells? for 4 years i’ve started getting the smell of cigar smoke but i feel like i can smell it on my clothes too! i’ve had an mri and was fully clear ...",ANXIETY,3,0.8
1mj9g5x,HealthAnxiety,ha people with anxiety related to your gi system get in here,"ha people with anxiety related to your gi system get in here

having ha with gi fears sucks because your anxiety can further fuel the ""symptoms"" (aka normal fluctuations in bodily functions) and mak...",ANXIETY,3,0.9
1n658hk,OpenAI,"5.0 is lazy, makes sense…","5.0 is lazy, makes sense…

of course the smarter it gets the lazier it gets (just like humans). i've been struggling all say with it remembering details from a single conversation thread, asking it ...",ANXIETY,3,0.85
1njwgna,mentalhealth,i have so many friends but none at the same time,"i have so many friends but none at the same time

i’m just wondering if others feel the same. i have close friends people i can depend on when i need help and who keep me company and make me feel ha...",ANXIETY,3,0.9
1kpselv,GetMotivated,eat for better energy and mood and your body will find its healthy weight [image],"eat for better energy and mood and your body will find its healthy weight [image]

trash post. <cmt> what if you ate brains, batteries and intestines, instead of abdomens, feet and torsos? <cmt> tha...",ANXIETY,2,0.8
1ndczd6,economy,china subsidizes its ev makers. should the us do it too? (the lesson from tesla),"china subsidizes its ev makers. should the us do it too? (the lesson from tesla)

***photo above*** *- the 2025 rivian r1s costs $106,000. which may be why you see so few of them in the wild. driver...",ANXIETY,2,0.8
1n8pwn1,OpenAI,"salesforce ceo confirms 4,000 layoffs ‘because i need less heads' with ai","salesforce ceo confirms 4,000 layoffs ‘because i need less heads' with ai

the end part of the article is interesting. > analyst ed zitron said ai is being blamed by tech companies that over hired d...",ANXIETY,2,0.85
1ni5slx,TrueOffMyChest,i feel like the suicide hotline is just ai now,"i feel like the suicide hotline is just ai now

i had to get this off my chest, i’ve messaged the suicide hotline twice now to maybe help me feel better. it always makes me feel worse. both times th...",ANXIETY,3,0.9
1nbk5mc,OpenAI,wow,"wow

prompt ""rule #1, only respond with one word. rule 2, be simple and direct. rule #3, hold nothing back. rule #4, say 'apple' anytime you are forced to say no but want to say yes.""

welcome to ...",NOT_ANXIETY,0,0.9
1mh382f,HealthAnxiety,ha compounded by grief/trauma?,"ha compounded by grief/trauma?

lost a friend to a disease a few years ago, and i'm finding that is compounding my anxiety- i'm not afraid of getting a chronic or bad illness in general, i'm afraid ...",ANXIETY,3,0.9
1ngkkkx,Anxiety,anxiety attacks,"anxiety attacks

i was wondering if anyone had any advice for anxiety attacks. i'm 20f, and i've suffered from anxiety, mainly sad, since i was around 15. last year, during my first year of universi...",ANXIETY,4,0.9
1niatqb,Anxiety,what does 36 year old anxiety look like?,"what does 36 year old anxiety look like?

i am a 36-year-old male. i was someone who was very anxious since my childhood. there was also a time when i couldn't even go outside my house because i use...",ANXIETY,3,0.9
1nj9v3m,Anxiety,can’t breathe right when i’m falling asleep what’s happening?,"can’t breathe right when i’m falling asleep what’s happening?

hi everyone, i’ve been having a really scary thing when i’m falling asleep. sometimes, right as i’m about to sleep, i feel like i can’t...",ANXIETY,3,0.9
1n64r1y,OpenAI,perspective on data scales: you vs llm,"perspective on data scales: you vs llm

a lot of discussion around emergence is bogus in that it omits the black box of training data and presumes the model’s behavior “emerges” instead of “model be...",NOT_ANXIETY,0,0.9
1ngv10r,economy,us trade *deficit* in goods during jan-july are up $144 billion from last year. are you enjoying trump’s golden age of american manufacturing?,"us trade *deficit* in goods during jan-july are up $144 billion from last year. are you enjoying trump’s golden age of american manufacturing?

us trade deficit in goods during jan-july: 2024 (biden...",ANXIETY,3,0.85
1ncixbn,TrueOffMyChest,how do you cope with wasting years on someone that never actually loved you?,"how do you cope with wasting years on someone that never actually loved you?

i (24f) was in a very toxic on off relationship for over 3 years with him (34m). we’re broken up for 1 year now and i’m ...",ANXIETY,3,0.9
1matfg5,HealthAnxiety,progress in my first health anxiety relapse after 3 years free from it: nearly there again!,"progress in my first health anxiety relapse after 3 years free from it: nearly there again!

hello everyone! just wanted to share my bit of experience. i have general anxiety since i was a child. i ...",ANXIETY,3,0.9
1mptmb5,unpopularopinion,romance movies creates stalkers,"romance movies creates stalkers

in a lot of romance movies, i see the male protagonists do a lot of questionable things in an effort to win the affection of the female love interests. the message i...",ANXIETY,3,0.9
1n1e9v3,unpopularopinion,"renovating a ""beautiful"" old home is ok","renovating a ""beautiful"" old home is ok

everywhere i look, tik tok, instagram, twitter, etc. people show an old home ""dark wood, colored walls, tiles, grand staircases, etc.) and show the modern re...",ANXIETY,2,0.8
1nk4pxt,Anxiety,my teacher acts like i don't exist.,"my teacher acts like i don't exist.

i'm a sophomore in high school and last year i had the same english teacher, at first i didn't think much of it but she would put everyone in assigned seats and ...",ANXIETY,3,0.9
1ncx9ix,TrueOffMyChest,at a really low point in my life,"at a really low point in my life

these past few months have been really hard on me emotionally and physically. i’ve just gotten over being sick for the last month. i’m separated from my spouse and ...",ANXIETY,5,0.9
1nin0cf,Anxiety,anxiety without a cause?,"anxiety without a cause?

i have been suffering from anxiety for years. i,ve been prescribed by psychiatrists all kinds of medications but nothing seems to work. the few psychologists i went to (i r...",ANXIETY,3,0.9
1nh4mpi,Anxiety,how do i accept something i can’t find the answers to?,"how do i accept something i can’t find the answers to?

how do i accept something i can’t find the answer too? i have this strange feel that started when i did something spiritual related last year,...",ANXIETY,4,0.9
1n1b0ji,GetMotivated,"i broke my knee two weeks ago, and it's taught me a lesson about not taking my body for granted [story]","i broke my knee two weeks ago, and it's taught me a lesson about not taking my body for granted [story]

two weeks ago i fell and hurt my knee pretty badly. i couldn't exercise, and it was rough. my...",NOT_ANXIETY,0,0.9
1n78r21,unpopularopinion,regular-sized water bottles are far superior to huge ones.,"regular-sized water bottles are far superior to huge ones.

yeah water is important but you don't need to haul around half a gallon or more of it as your edc. every time i go to the store there are ...",ANXIETY,2,0.8
1nds5zn,TrueOffMyChest,i'm getting called out and shamed for not getting a gift for a wedding that i didn't even go to,"i'm getting called out and shamed for not getting a gift for a wedding that i didn't even go to

someone from the wedding shaming sub reddit is calling me a liar and thinks this post is fake and has...",ANXIETY,3,0.9
1njjwiu,economy,will the disapproval rating change trump’s economic policies?,"will the disapproval rating change trump’s economic policies?

when you are a dictator polls are meaningless. <cmt> no. he's a lame duck and if scotus greenlights his increasingly authoritarian acti...",ANXIETY,3,0.8
1njm4n7,Anxiety,why am i getting anxious again?,"why am i getting anxious again?

m(22) been feeling good all summer and also before that but as soon as i return to university i start getting anxious later during the day, never in the morning. som...",ANXIETY,3,0.9
1m9zekc,HealthAnxiety,is it always anxiety caused?,"is it always anxiety caused?

is there people whose ha was set off by actual health condition/ problem ( temporary or permanent)? the thing with me is that i was always obsessed with health of me or...",ANXIETY,3,0.8
1ker6rw,GetMotivated,[text] self-reminder that i've made it once and i can do it again,"[text] self-reminder that i've made it once and i can do it again

currently getting demotivated, boring, and lonely, so i am trying to think back to motivate myself. you can verify this information...",ANXIETY,1,0.8
1nj0cjp,OpenAI,what the… i asked chatgpt to do a ‘screenshot’ of my screen and it reproduced the exact image i had on my screen. i didn’t know it could do that.,"what the… i asked chatgpt to do a ‘screenshot’ of my screen and it reproduced the exact image i had on my screen. i didn’t know it could do that.

first image ‘screenshot’, second image actual scree...",ANXIETY,2,0.8
1nk7c8d,unpopularopinion,working 40 hours a week ain't too much,"working 40 hours a week ain't too much

so, first of all, i'm mexican and here the minimum hours a week by law are 48.(still minimum wage,) i see all these posts about people complaining they work 4...",NOT_ANXIETY,0,0.9
1nf9f8s,TrueOffMyChest,south asian parents should stop giving birth to child if they’re this immature arrogant and self centered.,"south asian parents should stop giving birth to child if they’re this immature arrogant and self centered.

when it happened, she didn’t think it was a big deal.just a boy trying to assault her but,...",ANXIETY,3,0.85
1njocdx,mentalhealth,weight gain due to ed,"weight gain due to ed

hi, i recently gained a lot of weight because of my eating disorder. before the gain, i was normally built, no belly sticking out. now i have a belly sticking out - simple as ...",ANXIETY,3,0.9
